{"assets":[{"name":"SHA256SUMS","role":"checksums","sha256":"sha256:e754d46c22d15be14ee34a277c71c91a409b076920794b71a83a14eea4b18680","size_bytes":781},{"name":"TOOL-BUNDLE-PUBLICATION.json","role":"publication-manifest","sha256":"sha256:e052dc2c124cb6fd3b975dd41cc9dee92852e15d7987fb22f2b9588d1fb2641a","size_bytes":1346},{"name":"install-proofbound-tools.py","role":"installer","sha256":"sha256:ac2cd4eb831be0c06c321787ead340652c25cc3ed883f391b75db422b1d85c32","size_bytes":16696},{"name":"proofbound-tools-95124692b6b9383a265c8024f21bb964737f8b6b-linux-aarch64.manifest.json","role":"bundle-manifest","sha256":"sha256:549e6bd881d874bbcd8987e5605d398e601de4a9ce06081e135f3f6033466769","size_bytes":6041},{"name":"proofbound-tools-95124692b6b9383a265c8024f21bb964737f8b6b-linux-aarch64.tar.gz","role":"archive","sha256":"sha256:24eecf2b59b14444325f05c82afced3e788222229829236f656958969388bbff","size_bytes":7507407},{"name":"proofbound-tools-95124692b6b9383a265c8024f21bb964737f8b6b-linux-x86_64.manifest.json","role":"bundle-manifest","sha256":"sha256:ef6de5097e41f2df75ca1e2aff19e583e0fbee3a4c1ff877604f72b21d5ed151","size_bytes":6040},{"name":"proofbound-tools-95124692b6b9383a265c8024f21bb964737f8b6b-linux-x86_64.tar.gz","role":"archive","sha256":"sha256:65c1bce4397cefeeb7aba452829bf883c3314f606b97296460a137c9938bab89","size_bytes":8255085}],"bundle_workflow_run_id":34900896450,"producer_repository":"bordumb/proof-bound","release_id":388736918,"release_tag":"proofbound-tools-95124692b6b9383a265c8024f21bb964737f8b6b","schema":"proofbound-runtime-proofbound-tool-pin/1","source_revision":"95124692b6b9383a265c8024f21bb964737f8b6b","verification_run_id":34899222179}
